{"schema_version":"1.1.0","release_id":"SYNTH_RELEASE_NOT_AUTHORIZED","branch_id":"A_BASELINE_BIO","state":"SPECIFICATION_ONLY","evidence_class":"SPECIFICATION","source_universe_version":"NOT_FROZEN","required_source_ids":[],"admitted_source_ids":[],"requires_final_test":false,"software_gate":"NOT_RUN","data_gate":"NOT_RUN","statistical_gate":"NOT_RUN","protected_set_gate":"NOT_RUN","admission_receipt_ids":[],"matrix_build_receipt_ids":[],"config_sha256":null,"environment_sha256":null,"split_sha256":null,"model_sha256":null,"weight_registry_sha256":null,"reviewer":null,"reviewed_utc":null,"blocked_reasons":["No admitted source population, numerical freeze or real-data validation is asserted."]}
